{
  "schema_version": 1,
  "label": "integrated-3",
  "timestamp_utc": "2026-04-18T04:14:24Z",
  "compiled": true,
  "correct": true,
  "kernel_info": {
    "has_tlx": false,
    "gemm1": "unknown",
    "gemm2": "unknown"
  },
  "workloads": [
    {
      "uuid": "b8f4f012-a32e-4356-b4e1-7665b3d598af",
      "seq_len": 7,
      "status": "PASSED",
      "latency_ms": 0.42331276839971543,
      "reference_latency_ms": 11.63135668182373,
      "speedup_factor": 27.47698049788273,
      "max_abs_error": 3072.0,
      "max_rel_error": 693.5128173828125,
      "sota_ms": 0.095,
      "sota_gap": 4.455923877891741
    },
    {
      "uuid": "e05c6c03-5603-4a1c-b34c-dcce0ecaeea4",
      "seq_len": 1,
      "status": "PASSED",
      "latency_ms": 0.4032343038916588,
      "reference_latency_ms": 11.056368818283081,
      "speedup_factor": 27.419216846326922,
      "max_abs_error": 4096.0,
      "max_rel_error": 688.8072509765625,
      "sota_ms": 0.063,
      "sota_gap": 6.400544506216806
    },
    {
      "uuid": "6230e838-67ca-41dd-a9d6-6f36b7676c6b",
      "seq_len": 32,
      "status": "PASSED",
      "latency_ms": 0.5323706226944923,
      "reference_latency_ms": 13.942292751312255,
      "speedup_factor": 26.18907234352264,
      "max_abs_error": 4096.0,
      "max_rel_error": 513.8763427734375,
      "sota_ms": 0.201,
      "sota_gap": 2.648610063156678
    },
    {
      "uuid": "8f1ff9f1-6747-41d1-a1d8-2868cdacf893",
      "seq_len": 80,
      "status": "PASSED",
      "latency_ms": 0.608992126584053,
      "reference_latency_ms": 15.842149124145507,
      "speedup_factor": 26.01371747284647,
      "max_abs_error": 4096.0,
      "max_rel_error": 2482.23046875,
      "sota_ms": 0.269,
      "sota_gap": 2.2639112512418325
    },
    {
      "uuid": "1a4c6ba1-3cd2-4d7d-b716-84f2d52b69fc",
      "seq_len": 901,
      "status": "PASSED",
      "latency_ms": 1.2067343988418577,
      "reference_latency_ms": 20.954647117614748,
      "speedup_factor": 17.36475494336252,
      "max_abs_error": 370688.0,
      "max_rel_error": 37068801572864.0,
      "sota_ms": 0.699,
      "sota_gap": 1.7263725305319855
    },
    {
      "uuid": "a7c2bcfd-a2f4-479e-8d32-200115df89cf",
      "seq_len": 16,
      "status": "PASSED",
      "latency_ms": 0.4678725125789642,
      "reference_latency_ms": 12.651909580230713,
      "speedup_factor": 27.04136114022175,
      "max_abs_error": 4096.0,
      "max_rel_error": 237.39999389648438,
      "sota_ms": 0.138,
      "sota_gap": 3.3903805259345225
    },
    {
      "uuid": "2e69caee-ae5c-473b-aa99-5dc6659829d4",
      "seq_len": 15,
      "status": "PASSED",
      "latency_ms": 0.41168332809209823,
      "reference_latency_ms": 11.487429580688476,
      "speedup_factor": 27.90355789709951,
      "max_abs_error": 4096.0,
      "max_rel_error": 268.3777770996094,
      "sota_ms": 0.091,
      "sota_gap": 4.523992616396684
    },
    {
      "uuid": "8cba5890-4288-448a-93b8-42c14c6b9420",
      "seq_len": 14,
      "status": "PASSED",
      "latency_ms": 0.4575879678726197,
      "reference_latency_ms": 12.406977922439575,
      "speedup_factor": 27.113863985806,
      "max_abs_error": 4096.0,
      "max_rel_error": 498.72113037109375,
      "sota_ms": 0.132,
      "sota_gap": 3.4665755141865127
    },
    {
      "uuid": "5e8dc11c-f2a9-42d5-8dce-9419cbf34d5d",
      "seq_len": 14107,
      "status": "PASSED",
      "latency_ms": 7.286182987213135,
      "reference_latency_ms": 45.06876637268066,
      "speedup_factor": 6.1855111862787355,
      "max_abs_error": 512000.0,
      "max_rel_error": 51199998951424.0,
      "sota_ms": 5.579,
      "sota_gap": 1.306001610900365
    },
    {
      "uuid": "58a34f27-7995-4155-8b46-f60a7225e20e",
      "seq_len": 11948,
      "status": "PASSED",
      "latency_ms": 4.946397569656372,
      "reference_latency_ms": 35.869004989624024,
      "speedup_factor": 7.251541042649318,
      "max_abs_error": 565248.0,
      "max_rel_error": 54476798951424.0,
      "sota_ms": 3.671,
      "sota_gap": 1.347425107506503
    },
    {
      "uuid": "5eadab1e-a0e3-4966-b0fd-1115cd77497c",
      "seq_len": 62,
      "status": "PASSED",
      "latency_ms": 0.4861201920509338,
      "reference_latency_ms": 13.779933588027955,
      "speedup_factor": 28.346762412584884,
      "max_abs_error": 4096.0,
      "max_rel_error": 1837.163818359375,
      "sota_ms": 0.2,
      "sota_gap": 2.4306009602546688
    },
    {
      "uuid": "eedc63b2-c03b-4cf2-8d16-1f46566e3af7",
      "seq_len": 59,
      "status": "PASSED",
      "latency_ms": 0.5152098569869995,
      "reference_latency_ms": 13.626284362792969,
      "speedup_factor": 26.448027299945092,
      "max_abs_error": 4096.0,
      "max_rel_error": 12608.9951171875,
      "sota_ms": 0.202,
      "sota_gap": 2.5505438464702945
    },
    {
      "uuid": "e626d3e6-6c29-4fd8-bb7c-5b09eec61702",
      "seq_len": 58,
      "status": "PASSED",
      "latency_ms": 0.5625028482675553,
      "reference_latency_ms": 15.307668729782105,
      "speedup_factor": 27.21349549949477,
      "max_abs_error": 4096.0,
      "max_rel_error": 2580.041015625,
      "sota_ms": 0.242,
      "sota_gap": 2.324391934989898
    },
    {
      "uuid": "74d7ff04-0365-4cf8-a824-ce61b7131dea",
      "seq_len": 57,
      "status": "PASSED",
      "latency_ms": 0.5723075203895569,
      "reference_latency_ms": 14.841511699676513,
      "speedup_factor": 25.93275672766667,
      "max_abs_error": 4096.0,
      "max_rel_error": 2294.269287109375,
      "sota_ms": 0.237,
      "sota_gap": 2.4147996640909577
    },
    {
      "uuid": "4822167c-dae5-4bb1-bb53-e4adb256245b",
      "seq_len": 56,
      "status": "PASSED",
      "latency_ms": 0.5713315836191177,
      "reference_latency_ms": 14.916880506515502,
      "speedup_factor": 26.1089723274601,
      "max_abs_error": 4096.0,
      "max_rel_error": 33224.09375,
      "sota_ms": 0.24,
      "sota_gap": 2.3805482650796574
    },
    {
      "uuid": "81955b1e-086f-49c1-9f40-a18a5aaf509d",
      "seq_len": 55,
      "status": "PASSED",
      "latency_ms": 0.569904960989952,
      "reference_latency_ms": 14.48825964164734,
      "speedup_factor": 25.422238150867376,
      "max_abs_error": 4096.0,
      "max_rel_error": 1679.515380859375,
      "sota_ms": 0.233,
      "sota_gap": 2.4459440385834847
    },
    {
      "uuid": "76010cb4-f73c-4145-8365-8642a2ce99de",
      "seq_len": 54,
      "status": "PASSED",
      "latency_ms": 0.5201589119434357,
      "reference_latency_ms": 14.260386369705198,
      "speedup_factor": 27.415441785713238,
      "max_abs_error": 4096.0,
      "max_rel_error": 741.6813354492188,
      "sota_ms": 0.218,
      "sota_gap": 2.386050054786402
    },
    {
      "uuid": "fc378037-e8fa-4305-b00f-4af47933fd53",
      "seq_len": 53,
      "status": "PASSED",
      "latency_ms": 0.5513565433025359,
      "reference_latency_ms": 14.527980178833008,
      "speedup_factor": 26.34951984393397,
      "max_abs_error": 4096.0,
      "max_rel_error": 1381.4000244140625,
      "sota_ms": 0.23,
      "sota_gap": 2.3972023621849385
    },
    {
      "uuid": "f7d6ac7c-24ec-47e4-aefc-4863a5e3e1d9",
      "seq_len": 52,
      "status": "PASSED",
      "latency_ms": 0.48720044755935665,
      "reference_latency_ms": 13.210993404388427,
      "speedup_factor": 27.116135608186,
      "max_abs_error": 3072.0,
      "max_rel_error": 699.810791015625,
      "sota_ms": 0.179,
      "sota_gap": 2.721790209828808
    }
  ],
  "runtime_ms_mean": 1.1358137605754954,
  "ref_runtime_ms_mean": 16.835305337905886,
  "speedup_mean": 24.22699615851835,
  "sota_geomean_gap": 2.617607277186375,
  "sota_total_headroom_ms": 8.66146145093441,
  "sota_converged_count": 0,
  "sota_eligible_count": 19
}