{
  "schema_version": 1,
  "label": "iter-3",
  "timestamp_utc": "2026-04-18T01:41:44Z",
  "compiled": true,
  "correct": false,
  "kernel_info": {
    "has_tlx": false,
    "gemm1": "unknown",
    "gemm2": "unknown"
  },
  "workloads": [
    {
      "uuid": "b8f4f012-a32e-4356-b4e1-7665b3d598af",
      "seq_len": 7,
      "status": "RUNTIME_ERROR",
      "latency_ms": null,
      "reference_latency_ms": null,
      "speedup_factor": null,
      "max_abs_error": null,
      "max_rel_error": null,
      "sota_ms": 0.095,
      "sota_gap": null
    },
    {
      "uuid": "e05c6c03-5603-4a1c-b34c-dcce0ecaeea4",
      "seq_len": 1,
      "status": "RUNTIME_ERROR",
      "latency_ms": null,
      "reference_latency_ms": null,
      "speedup_factor": null,
      "max_abs_error": null,
      "max_rel_error": null,
      "sota_ms": 0.063,
      "sota_gap": null
    },
    {
      "uuid": "6230e838-67ca-41dd-a9d6-6f36b7676c6b",
      "seq_len": 32,
      "status": "RUNTIME_ERROR",
      "latency_ms": null,
      "reference_latency_ms": null,
      "speedup_factor": null,
      "max_abs_error": null,
      "max_rel_error": null,
      "sota_ms": 0.201,
      "sota_gap": null
    },
    {
      "uuid": "8f1ff9f1-6747-41d1-a1d8-2868cdacf893",
      "seq_len": 80,
      "status": "RUNTIME_ERROR",
      "latency_ms": null,
      "reference_latency_ms": null,
      "speedup_factor": null,
      "max_abs_error": null,
      "max_rel_error": null,
      "sota_ms": 0.269,
      "sota_gap": null
    },
    {
      "uuid": "1a4c6ba1-3cd2-4d7d-b716-84f2d52b69fc",
      "seq_len": 901,
      "status": "RUNTIME_ERROR",
      "latency_ms": null,
      "reference_latency_ms": null,
      "speedup_factor": null,
      "max_abs_error": null,
      "max_rel_error": null,
      "sota_ms": 0.699,
      "sota_gap": null
    },
    {
      "uuid": "a7c2bcfd-a2f4-479e-8d32-200115df89cf",
      "seq_len": 16,
      "status": "RUNTIME_ERROR",
      "latency_ms": null,
      "reference_latency_ms": null,
      "speedup_factor": null,
      "max_abs_error": null,
      "max_rel_error": null,
      "sota_ms": 0.138,
      "sota_gap": null
    },
    {
      "uuid": "2e69caee-ae5c-473b-aa99-5dc6659829d4",
      "seq_len": 15,
      "status": "RUNTIME_ERROR",
      "latency_ms": null,
      "reference_latency_ms": null,
      "speedup_factor": null,
      "max_abs_error": null,
      "max_rel_error": null,
      "sota_ms": 0.091,
      "sota_gap": null
    },
    {
      "uuid": "8cba5890-4288-448a-93b8-42c14c6b9420",
      "seq_len": 14,
      "status": "RUNTIME_ERROR",
      "latency_ms": null,
      "reference_latency_ms": null,
      "speedup_factor": null,
      "max_abs_error": null,
      "max_rel_error": null,
      "sota_ms": 0.132,
      "sota_gap": null
    },
    {
      "uuid": "5e8dc11c-f2a9-42d5-8dce-9419cbf34d5d",
      "seq_len": 14107,
      "status": "RUNTIME_ERROR",
      "latency_ms": null,
      "reference_latency_ms": null,
      "speedup_factor": null,
      "max_abs_error": null,
      "max_rel_error": null,
      "sota_ms": 5.579,
      "sota_gap": null
    },
    {
      "uuid": "58a34f27-7995-4155-8b46-f60a7225e20e",
      "seq_len": 11948,
      "status": "RUNTIME_ERROR",
      "latency_ms": null,
      "reference_latency_ms": null,
      "speedup_factor": null,
      "max_abs_error": null,
      "max_rel_error": null,
      "sota_ms": 3.671,
      "sota_gap": null
    },
    {
      "uuid": "5eadab1e-a0e3-4966-b0fd-1115cd77497c",
      "seq_len": 62,
      "status": "RUNTIME_ERROR",
      "latency_ms": null,
      "reference_latency_ms": null,
      "speedup_factor": null,
      "max_abs_error": null,
      "max_rel_error": null,
      "sota_ms": 0.2,
      "sota_gap": null
    },
    {
      "uuid": "eedc63b2-c03b-4cf2-8d16-1f46566e3af7",
      "seq_len": 59,
      "status": "RUNTIME_ERROR",
      "latency_ms": null,
      "reference_latency_ms": null,
      "speedup_factor": null,
      "max_abs_error": null,
      "max_rel_error": null,
      "sota_ms": 0.202,
      "sota_gap": null
    },
    {
      "uuid": "e626d3e6-6c29-4fd8-bb7c-5b09eec61702",
      "seq_len": 58,
      "status": "RUNTIME_ERROR",
      "latency_ms": null,
      "reference_latency_ms": null,
      "speedup_factor": null,
      "max_abs_error": null,
      "max_rel_error": null,
      "sota_ms": 0.242,
      "sota_gap": null
    },
    {
      "uuid": "74d7ff04-0365-4cf8-a824-ce61b7131dea",
      "seq_len": 57,
      "status": "RUNTIME_ERROR",
      "latency_ms": null,
      "reference_latency_ms": null,
      "speedup_factor": null,
      "max_abs_error": null,
      "max_rel_error": null,
      "sota_ms": 0.237,
      "sota_gap": null
    },
    {
      "uuid": "4822167c-dae5-4bb1-bb53-e4adb256245b",
      "seq_len": 56,
      "status": "RUNTIME_ERROR",
      "latency_ms": null,
      "reference_latency_ms": null,
      "speedup_factor": null,
      "max_abs_error": null,
      "max_rel_error": null,
      "sota_ms": 0.24,
      "sota_gap": null
    },
    {
      "uuid": "81955b1e-086f-49c1-9f40-a18a5aaf509d",
      "seq_len": 55,
      "status": "RUNTIME_ERROR",
      "latency_ms": null,
      "reference_latency_ms": null,
      "speedup_factor": null,
      "max_abs_error": null,
      "max_rel_error": null,
      "sota_ms": 0.233,
      "sota_gap": null
    },
    {
      "uuid": "76010cb4-f73c-4145-8365-8642a2ce99de",
      "seq_len": 54,
      "status": "RUNTIME_ERROR",
      "latency_ms": null,
      "reference_latency_ms": null,
      "speedup_factor": null,
      "max_abs_error": null,
      "max_rel_error": null,
      "sota_ms": 0.218,
      "sota_gap": null
    },
    {
      "uuid": "fc378037-e8fa-4305-b00f-4af47933fd53",
      "seq_len": 53,
      "status": "RUNTIME_ERROR",
      "latency_ms": null,
      "reference_latency_ms": null,
      "speedup_factor": null,
      "max_abs_error": null,
      "max_rel_error": null,
      "sota_ms": 0.23,
      "sota_gap": null
    },
    {
      "uuid": "f7d6ac7c-24ec-47e4-aefc-4863a5e3e1d9",
      "seq_len": 52,
      "status": "RUNTIME_ERROR",
      "latency_ms": null,
      "reference_latency_ms": null,
      "speedup_factor": null,
      "max_abs_error": null,
      "max_rel_error": null,
      "sota_ms": 0.179,
      "sota_gap": null
    }
  ]
}